{
  "schema_version": "prc.control-check-program-definitions/v0.1",
  "scope": "structured_record",
  "source_binding_catalog_sha256": "c32c6b879025b571362d5852904769ef54d2400392d22e9adb4dde5757542740",
  "definition_count": 3,
  "definitions": [
    {
      "control_id": "USEQ-FBE1B27D",
      "control_revision": 1,
      "control_semantic_sha256": "fbe1b27db60b4186bd4fd86e68f782eefd2706380c175965ae088fb78cd4ae07",
      "clause_ordinal": 1,
      "clause_id": "88cc6e205ed2fe6e3c97f82ad12e5ee97c635f6e4596d4b9ba2a9cc25711d8fe",
      "clause_statement": "The authenticated versioned migration contract defines source state, target state, dual-operation period, negotiation rules, data conversion, key transition, validation evidence, stop conditions, and retirement criteria.",
      "checker_family": "structured_record",
      "required_authority": "structured_record",
      "corrected_checker_family": "structured_record",
      "corrected_required_authority": "structured_record",
      "classification_status": "exact_predicate",
      "classification_error_reason": null,
      "raw_fact_contracts": [
        {
          "fact_id": "sr.useq-fbe1b27d.c1.source_state",
          "fact_type": "string_map",
          "authority": "structured_record",
          "raw_value_semantics": "A canonical string_map keyed by the sealed migration contract identifiers; each value is the raw parsed source state. It is read for the exact clause: The authenticated versioned migration contract defines source state, target state, dual-operation period, negotiation rules, data conversion, key transition, validation evidence, stop conditions, and retirement criteria.",
          "source_requirement": "Use pinned lossless schema prc.structured-record.useq-fbe1b27d.c1@1 and read the concrete source_state member directly from every authenticated migration_contract record; reject aliases, inferred text matches, duplicate keys, and lossy coercion.",
          "complete_required": true
        },
        {
          "fact_id": "sr.useq-fbe1b27d.c1.target_state",
          "fact_type": "string_map",
          "authority": "structured_record",
          "raw_value_semantics": "A canonical string_map keyed by the sealed migration contract identifiers; each value is the raw parsed target state. It is read for the exact clause: The authenticated versioned migration contract defines source state, target state, dual-operation period, negotiation rules, data conversion, key transition, validation evidence, stop conditions, and retirement criteria.",
          "source_requirement": "Use pinned lossless schema prc.structured-record.useq-fbe1b27d.c1@1 and read the concrete target_state member directly from every authenticated migration_contract record; reject aliases, inferred text matches, duplicate keys, and lossy coercion.",
          "complete_required": true
        },
        {
          "fact_id": "sr.useq-fbe1b27d.c1.dual_operation_period",
          "fact_type": "string_map",
          "authority": "structured_record",
          "raw_value_semantics": "A canonical string_map keyed by the sealed migration contract identifiers; each value is the raw parsed dual operation period. It is read for the exact clause: The authenticated versioned migration contract defines source state, target state, dual-operation period, negotiation rules, data conversion, key transition, validation evidence, stop conditions, and retirement criteria.",
          "source_requirement": "Use pinned lossless schema prc.structured-record.useq-fbe1b27d.c1@1 and read the concrete dual_operation_period member directly from every authenticated migration_contract record; reject aliases, inferred text matches, duplicate keys, and lossy coercion.",
          "complete_required": true
        },
        {
          "fact_id": "sr.useq-fbe1b27d.c1.negotiation_rules",
          "fact_type": "string_map",
          "authority": "structured_record",
          "raw_value_semantics": "A canonical string_map keyed by the sealed migration contract identifiers; each value is the raw parsed negotiation rules. It is read for the exact clause: The authenticated versioned migration contract defines source state, target state, dual-operation period, negotiation rules, data conversion, key transition, validation evidence, stop conditions, and retirement criteria.",
          "source_requirement": "Use pinned lossless schema prc.structured-record.useq-fbe1b27d.c1@1 and read the concrete negotiation_rules member directly from every authenticated migration_contract record; reject aliases, inferred text matches, duplicate keys, and lossy coercion.",
          "complete_required": true
        },
        {
          "fact_id": "sr.useq-fbe1b27d.c1.data_conversion",
          "fact_type": "string_map",
          "authority": "structured_record",
          "raw_value_semantics": "A canonical string_map keyed by the sealed migration contract identifiers; each value is the raw parsed data conversion. It is read for the exact clause: The authenticated versioned migration contract defines source state, target state, dual-operation period, negotiation rules, data conversion, key transition, validation evidence, stop conditions, and retirement criteria.",
          "source_requirement": "Use pinned lossless schema prc.structured-record.useq-fbe1b27d.c1@1 and read the concrete data_conversion member directly from every authenticated migration_contract record; reject aliases, inferred text matches, duplicate keys, and lossy coercion.",
          "complete_required": true
        },
        {
          "fact_id": "sr.useq-fbe1b27d.c1.key_transition",
          "fact_type": "string_map",
          "authority": "structured_record",
          "raw_value_semantics": "A canonical string_map keyed by the sealed migration contract identifiers; each value is the raw parsed key transition. It is read for the exact clause: The authenticated versioned migration contract defines source state, target state, dual-operation period, negotiation rules, data conversion, key transition, validation evidence, stop conditions, and retirement criteria.",
          "source_requirement": "Use pinned lossless schema prc.structured-record.useq-fbe1b27d.c1@1 and read the concrete key_transition member directly from every authenticated migration_contract record; reject aliases, inferred text matches, duplicate keys, and lossy coercion.",
          "complete_required": true
        },
        {
          "fact_id": "sr.useq-fbe1b27d.c1.validation_evidence",
          "fact_type": "string_map",
          "authority": "structured_record",
          "raw_value_semantics": "A canonical string_map keyed by the sealed migration contract identifiers; each value is the raw parsed validation evidence. It is read for the exact clause: The authenticated versioned migration contract defines source state, target state, dual-operation period, negotiation rules, data conversion, key transition, validation evidence, stop conditions, and retirement criteria.",
          "source_requirement": "Use pinned lossless schema prc.structured-record.useq-fbe1b27d.c1@1 and read the concrete validation_evidence member directly from every authenticated migration_contract record; reject aliases, inferred text matches, duplicate keys, and lossy coercion.",
          "complete_required": true
        },
        {
          "fact_id": "sr.useq-fbe1b27d.c1.stop_conditions",
          "fact_type": "string_map",
          "authority": "structured_record",
          "raw_value_semantics": "A canonical string_map keyed by the sealed migration contract identifiers; each value is the raw parsed stop conditions. It is read for the exact clause: The authenticated versioned migration contract defines source state, target state, dual-operation period, negotiation rules, data conversion, key transition, validation evidence, stop conditions, and retirement criteria.",
          "source_requirement": "Use pinned lossless schema prc.structured-record.useq-fbe1b27d.c1@1 and read the concrete stop_conditions member directly from every authenticated migration_contract record; reject aliases, inferred text matches, duplicate keys, and lossy coercion.",
          "complete_required": true
        },
        {
          "fact_id": "sr.useq-fbe1b27d.c1.retirement_criteria",
          "fact_type": "string_map",
          "authority": "structured_record",
          "raw_value_semantics": "A canonical string_map keyed by the sealed migration contract identifiers; each value is the raw parsed retirement criteria. It is read for the exact clause: The authenticated versioned migration contract defines source state, target state, dual-operation period, negotiation rules, data conversion, key transition, validation evidence, stop conditions, and retirement criteria.",
          "source_requirement": "Use pinned lossless schema prc.structured-record.useq-fbe1b27d.c1@1 and read the concrete retirement_criteria member directly from every authenticated migration_contract record; reject aliases, inferred text matches, duplicate keys, and lossy coercion.",
          "complete_required": true
        }
      ],
      "sealed_parameter_contracts": [
        {
          "parameter_id": "sr.useq-fbe1b27d.c1.migration_contract_ids",
          "parameter_type": "string_set",
          "value_origin": "scanner_inventory",
          "source_requirement": "The complete nonempty migration contract identifier inventory is sealed before record collection from the authenticated scope manifest for USEQ-FBE1B27D clause 1; the structured-record provider cannot add, remove, or rename an item."
        }
      ],
      "predicate": {
        "op": "all",
        "args": [
          {
            "op": "map_keys_eq_set_parameter",
            "fact": "sr.useq-fbe1b27d.c1.source_state",
            "parameter": "sr.useq-fbe1b27d.c1.migration_contract_ids"
          },
          {
            "op": "string_map_all_nonempty",